{
  "conforms_to": "https://schemas.neuron7xlab.org/research/research_inference_artifact.schema.json",
  "schema_version": "1.0.0",
  "research_line": "ricci_microstructure",
  "run_id": "RFC-2026-MARKET-RICCI-V1",
  "git_sha": "72719a49cc87c6f165f4587300a01ecdc6b54ee7",
  "git_dirty": false,
  "data_sha256": "31851727f99a25b3937454c6cf95bd6ec9f602351ca1572375f7f1bdd3baef64",
  "config_sha256": "447b5cedffe4479dafbc02fb0ff86cc52e9cca1fe89740a56089c31344df1eb3",
  "seed": 0,
  "timestamp_utc": "1970-01-01T00:00:00Z",
  "input_window_sec": 30,
  "score": 0.0,
  "uncertainty": 0.0,
  "decision": "OBSERVE",
  "claim_tier": "HYPOTHESIS",
  "falsification_status": "NOT_RUN"
}
